aviso para dejar vacante,"Esta es una orden judicial que le da 5 días para dejar su casa. Si no se muda, el alguacil lo sacará de su unidad de alquiler e impedirá que vuelva."
juramento,"Una promesa de decir la verdad, y que responsabiliza a la persona juramentada por perjurio si mintió a sabiendas."
infracción ,Un acto que viola (contraviene) la ley. 
ordenanza,"La legislación local de una ciudad, pueblo, municipalidad o condado, dictada por el órgano legislativo local."
fuera del matrimonio ,"Algo que ocurre cuando no están casados. Cuando un bebé nace o es concebido mientras la pareja estaba casada, el tribunal tiene que determinar que el bebé nació fuera del matrimonio antes de poder quitarle los derechos de paternidad al esposo. "
pagos por horas extra,Los empleados deben recibir por lo menos una vez y media la paga regular por cada hora que exceda de 40 horas trabajadas por semana. 
programa de horario de crianza,"En un divorcio, un documento que describe el acuerdo de los padres para compartir el tiempo con sus hijos."
perjurio,"El delito de mentir intencionalmente después de haber jurado decir la verdad ante un notario público, el secretario del tribunal u otro funcionario."
bien personal,"Un bien o posesión mueble, a diferencia de una propiedad inmueble, cosas como dinero en efectivo, acciones, alhajas, vestimenta, muebles o carros."
representante personal,El administrador o albacea nombrado por el tribunal para administrar la sucesión.
petición,Un pedido formal por escrito hecho al tribunal pidiendo una acción judicial específica. (Comparar con moción). 
custodia física,Donde un hijo debería vivir. La custodia legal es distinta de la custodia física. La custodia legal indica quién puede tomar decisiones por el hijo.
demandante,La persona o empresa que presenta una demanda formal ante el tribunal.
escritos iniciales,Declaraciones escritas presentadas ante el tribunal que describen las afirmaciones legales o sobre los hechos de una de las partes del caso.
poder,Un documento que le otorga a alguien autorización para actuar en su nombre en asuntos específicos. La persona que actúa en nombre de otra es su representante (o también mandatario o apoderado). La persona que le da la autorización al apoderado se llama mandante o poderdante.
preponderancia de las pruebas,El nivel de pruebas requerido en la mayoría de los juicios civiles (no penales). El demandante tiene que demostrar que es más probable que no que hayan ocurrido los hechos necesarios para ganar el caso. 
padre presunto,Un hombre cuya esposa dio a luz o concibió a un niño durante su matrimonio es el padre presunto de ese niño. Es el padre legal del niño hasta que un tribunal revoque su paternidad. 
pro se,Que se representa a sí mismo. Actuar como su propio abogado.
tutela testamentaria,Cuando un tribunal nombra a una persona u organización para que sea legalmente responsable por alguien que no se puede administrar por sí mismo. La persona u organización es el tuto; la persona a quien cuida es el pupilo.
sucesión,El proceso de probar que un testamento es válido y después hacer lo que dice el testamento.
caso testamentario,"El proceso legal utilizado para administrar un testamento en el tribunal. El proceso judicial utilizado para distribuir los bienes de una persona fallecida, pagar sus deudas y liquidar sus asuntos financieros."
condena condicional,Una opción de condena en los tribunales federales y estatales.
notificador legal; persona que entrega documentos legales,"Cualquier persona mayor de 18 años de edad que no esté involucrada en el caso y que entrega la citación y una copia de la demanda, y después proporciona al tribunal una declaración jurada de que realizó la entrega. "
prueba de entrega,"Un documento presentado ante el tribunal que demuestra que se entregaron los documentos judiciales en forma legal. La prueba de entrega muestra quién recibió los documentos, cuándo y dónde se entregaron y quién hizo la entrega. Es firmado por el encarado de la entrega y sirve como prueba de que la entrega legal se efectuó en forma apropiada. "
bienes del patrimonio,Todos los intereses legales o patrimoniales del deudor en propiedad al comienzo del caso.
fiscal,Un funcionario público que procesa casos penales para el estado; a veces se llama “fiscal de distrito”.
orden de protección,Orden no penal obtenida por un cónyuge abusado contra un cónyuge abusivo.
asistencia pública,"Beneficios, como dinero o cupones de comida, para ayudar a personas o familias necesitadas. Se envía información sobre las personas que solicitan ciertos tipos de asistencia pública (como Ayuda Temporal para Familias Necesitadas, TANF) automáticamente a la agencia estatal IV-D para identificar y ubicar al padre no custodial, establecer paternidad y/u obtener pagos de manutención de los hijos. Esto le permite al estado recuperar algo o parte del dinero que paga a personas en forma de asistencia pública. (Ver también IV-D)."
goce silencioso,"A veces los propietarios son responsables por condiciones que impiden al inquilino “gozar con tranquilidad” de su unidad de alquiler. Por ejemplo: 
~ Problemas de plomería que no fueron solucionados correctamente y causaron inundaciones repetidas en su unidad;
~ No hay suficiente calefacción durante el invierno;
~ Apoderarse de su espacio privado, como su patio, y convertirlo en un área común para compartir con otros inquilinos;
Si la interferencia es tan dañina que el inquilino se tiene que mudar, puede haber una buena razón legal por cancelar el contrato de alquiler. 
"
bien inmueble o bien raíz,Edificios y terrenos.
acta,"Un recuento por escrito de las actuaciones de un caso, incluyendo todos los alegatos, pruebas, pruebas documentarias, y el fallo dictado durante el caso."
alquiler renovable,Los alquileres que son renovables se pueden prolongar por el mismo periodo que el primer alquiler si el inquilino notifica al propietario tal como lo indica en el contrato de alquiler (en general 30 días antes de que venza el contrato). 
anticipo,Un honorario que el cliente le paga al abogado antes de que este comience a trabajar para el cliente.
represalia,"Los empleadores no pueden castigar o discriminar contra sus empleados porque estos ejercieron sus derechos. Esto se aplica a todos los trabajadores, sea cual fuere su situación inmigratoria. Si un empleador denuncia o amenaza con denunciar a un trabajador indocumentado a las autoridades de inmigración por quejarse debido a un incumplimiento laboral, el empleador puede ser acusado penalmente y/o quedar sujeto a penas civiles. "
sección 8,Un programa de ayuda para viviendas financiado por el gobierno federal que ayuda a inquilinos de bajos ingresos con los pagos de alquiler.
deudas con garantía,Usted tiene una deuda con garantía si firmó un contrato que le da al acreedor una garantía por la deuda. 
depósito de garantía,"Una cantidad de dinero que se da al propietario y que se puede usar para cubrir alquileres impagos, daños o gastos de limpieza. "
trabajo por cuenta propia,"Cuando uno es dueño de una empresa y trabaja en ella, a menos que se trate de una corporación. Es distinto que trabajar para un empleador o patrón."
bienes por separado,"Un bien que uno de los cónyuges tenía antes del matrimonio. Cualquier herencia recibida por uno de los cónyuges, aun durante el matrimonio, es bien por separado. También lo son las donaciones personales (a menos que hayan provenido del otro cónyuge) y pagos por lesiones personales."
entrega de proceso o aviso legal,La entrega de escritos o citaciones a la parte apropiada.
dejar de lado,"(v) Revocar o anular una orden o fallo judicial. Por ejemplo, la parte perdedora en un caso puede presentar una moción para pedirle al juez que deje de lado el veredicto. "
resolución,Resolver un caso legal antes de que vaya a juicio. La mayoría de los casos se resuelven antes de ir a juicio. Esto quiere decir que usted y la otra parte acuerdan ciertas cosas a cambio de no ir a juicio. Algunos tribunales ofrecen mediadores para ayudar a personas que tienen un conflicto a llegar a un acuerdo. 
tribunal de reclamos menores,"La división del tribunal de primera instancia que se hace cargo de casos civiles donde se pide una cantidad reducida de dinero. Un caso de reclamos menores está diseñado para ser simple, rápido y costar menos que un juicio civil regular. La cantidad máxima de dinero que se puede pedir depende de cada estado."
sucesiones pequeñas,"Un patrimonio que contiene bienes de valor suficientemente bajo como para poder utilizar procedimientos testamentarios simplificados conforme a la ley estatal, o transferencias extrajudiciales de los bienes del difunto."
cónyuge,Esposo o esposa.
acecho,Acosar a alguien en forma repetida y obsesiva de manera alarmante o que genera miedo.
ley de prescripción,El plazo en el que se debe presentar una demanda o iniciar una causa penal. Este plazo puede variar según el tipo de caso civil o el delito del cual se acusa. 
ley,Una ley aprobada por una legislatura.
suspensión de cumplimiento,"Una orden judicial que le da más tiempo para mudarse, en general alrededor de una semana. Tendrá que pagar el alquiler por esa semana adicional."
citatorio,Una orden emitida en virtud de la autoridad de un tribunal para que comparezca un testigo y preste testimonio. 
subsidio,"Dinero dado por una entidad gubernamental para mantener un precio bajo. En programas de vivienda, un subsidio frecuentemente es dinero que se paga a un propietario como parte del alquiler de un inquilino."
sucesor,"Cualquier persona que tenga el derecho legal a recibir los bienes de una persona cuando fallece, ya sea porque así lo dice el testamento o el Código Testamentario."
suspensión,Suspensión o quedar suspendido quiere decir que no puede ir a la escuela o participar de sus actividades por hasta 90 días (en algunos estados).
inquilinato,"El derecho exclusivo del inquilino, creado por el acuerdo de alquiler entre el propietario y el inquilino, a usar y poseer la unidad de alquiler del propietario."
inquilino,Una persona que tiene el derecho legal de vivir en o usar una propiedad
testado,Una persona que fallece dejando un testamento.
testador,Una persona que ha escrito un testamento.
testimonio,Pruebas presentadas oralmente por testigos durante juicios o ante jurados de acusación.
fideicomiso,Un acuerdo por el cual se entregan uno o más bienes a alguien para que lo tenga o administre en beneficio de otra persona.
divorcio de común acuerdo,"Cuando el demandado no va a tratar de parar el proceso de divorcio y el tribunal no tiene asuntos que decidir sobre los hijos, dinero o bienes. "
influencia indebida,"La cantidad de presión que alguien usa para obligar a otra a firmar un testamento que distribuya los activos de una cierta manera, hacer una donación mientras esté con vida o firmar un contrato. "
retención ilícita,Cuando una persona retiene o no cede bienes inmuebles que ya no le pertenecen legalmente.
compañía de servicios públicos,"Una compañía que suministra gas, agua, servicios eléctricos, agua caliente y calefacción. En algunos estados el propietario tiene que pagar por los servicios públicos. "
contravención/violación,"No cumplir con un derecho, deber o ley."
embargo de sueldo,Un procedimiento legal fuera de la ley de quiebras por el cual un demandante o acreedor trata de sujetar su reclamo al sueldo futuro de un deudor.
testamento,Un documento legal que indica lo que una persona desea que se haga con sus bienes después de su muerte.
mandamiento de cumplimiento,Una orden judicial que permite a un alguacil desalojarlo a usted y sacar sus pertenencias de una propiedad y no dejarlo entrar más. 
mandamiento,"Una orden del tribunal mediante la que se instruye a una persona que tome, o deje de tomar, una medida en particular. "
